{"baselineCandidateID":"margin-0.3.2-structured-manual-v17","baselineMarginSha256":"63896b7b5afda0691a8c7855e50f9b989cd7b519eb15e51713cf1096175f7964","candidateID":"margin-0.3.2-agent-recovery-v20","candidateMarginSha256":"226ca821523802813f77975f2bb9c9f1c9ac8c6424665dcb90c6db61aa10f7e1","episodeCount":1,"losses":0,"meanCommandCountDelta":-1.0,"meanDurationMsDelta":-9313.786,"meanInvalidCommandCountDelta":-4.0,"meanScoreDelta":70.625,"minimumPairsForPromotion":20,"promotable":false,"safetyRegressions":[],"sampleSizeSufficient":false,"schema":"urn:marginbench:paired-comparison:v1","scoreDelta95CI":[70.625,70.625],"ties":0,"wins":1}